{
  "schema_version": "cz-scene-0.3",
  "scene_id": "e1_recovery_candidate",
  "seed": 172026,
  "raster": {
    "width": 384,
    "height": 384,
    "samples_per_axis": 2,
    "invert": false
  },
  "timeline": {
    "sim_hz": 60,
    "fps_out": 30,
    "frame_count": 180
  },
  "field": {
    "kind": "gaussian-separable-v1",
    "threshold": 0.85
  },
  "elements": [
    {
      "id": "core_00",
      "group": "body",
      "home_xy": [
        0.0,
        -0.25
      ],
      "sigma": 0.24,
      "weight": 1.0,
      "mass": 1.0,
      "spring_k": 14.0,
      "damping_c": 5.0
    },
    {
      "id": "core_01",
      "group": "body",
      "home_xy": [
        0.0,
        0.0
      ],
      "sigma": 0.23,
      "weight": 1.0,
      "mass": 1.0,
      "spring_k": 14.0,
      "damping_c": 5.0
    },
    {
      "id": "head_00",
      "group": "head",
      "home_xy": [
        0.0,
        0.3
      ],
      "sigma": 0.2,
      "weight": 1.0,
      "mass": 1.0,
      "spring_k": 14.0,
      "damping_c": 5.0
    },
    {
      "id": "head_01",
      "group": "head",
      "home_xy": [
        0.08,
        0.48
      ],
      "sigma": 0.11,
      "weight": 0.8,
      "mass": 1.0,
      "spring_k": 14.0,
      "damping_c": 5.0
    },
    {
      "id": "accent_left",
      "group": "accent",
      "home_xy": [
        -0.23,
        0.3
      ],
      "sigma": 0.09,
      "weight": 0.9,
      "mass": 1.0,
      "spring_k": 14.0,
      "damping_c": 5.0
    },
    {
      "id": "accent_right",
      "group": "accent",
      "home_xy": [
        0.23,
        0.3
      ],
      "sigma": 0.09,
      "weight": 0.9,
      "mass": 1.0,
      "spring_k": 14.0,
      "damping_c": 5.0
    },
    {
      "id": "base_left",
      "group": "body",
      "home_xy": [
        -0.13,
        -0.48
      ],
      "sigma": 0.11,
      "weight": 0.9,
      "mass": 1.0,
      "spring_k": 14.0,
      "damping_c": 5.0
    },
    {
      "id": "base_right",
      "group": "body",
      "home_xy": [
        0.13,
        -0.48
      ],
      "sigma": 0.11,
      "weight": 0.9,
      "mass": 1.0,
      "spring_k": 14.0,
      "damping_c": 5.0
    }
  ],
  "cues": [
    {
      "id": "surprise",
      "group": "head",
      "start_tick": 45,
      "end_tick": 120,
      "force_xy": [
        2.0,
        1.0
      ],
      "envelope": "quartic-pulse-v1"
    }
  ],
  "limits": {
    "max_displacement": 0.75,
    "max_speed": 3.0,
    "max_total_force": 6.0
  }
}
